{
  "id": "corpus-management-team-value-ledger",
  "kind": "win-win-value-ledger",
  "unit": "corpus-management-team",
  "entries": [],
  "rules": [
    "value created and value captured are separate",
    "no amount is booked from the unit's own unsupported assertion",
    "a rank leg requires a contracted receipt recomputable from enterprise-record cover incidence cells edges components and H1",
    "a full pricing cocone separately requires top mass mint jump causal and rank legs",
    "no physical kT ln 2 unit weld or payment-protocol settlement is claimed"
  ]
}
